sno,title,summary,link,pub_date,topic
0,The difference between Business Analysis and Business Analytics,"Business Analysis

It is mainly used to analyze the company's entire working process, business development, and other aspects. Such as discovering new business needs, and proposing/improving solutions to certain business problems. It may include changes in the company's organization, improvement of business processes, strategic planning, policy…",https://medium.com/dataprophet/the-difference-between-business-analysis-and-business-analytics-d55bd3cdaf5?source=rss------deep_learning-5,16-10-2021 06:09,news
1,Writing Off the Expenses of Starting Your Own Business,"Starting a business is no easy task, and some significant expenses can apply. Depending on your business scope, you may be able to deduct certain startup costs as business expenses from your taxes. Business expenses are costs incurred by your business to generate more revenue. 
 
Any expense that helps your business make more money could potentially count as a business expense. This can include costs such as advertising, payroll, rent, software fees, utility fees, and more. 
 
To help your startup save money, you should understand how to achieve the maximum tax deductions.",https://www.thebalance.com/writing-off-the-expenses-of-starting-your-own-business-5206929,22-10-2021 20:46,news
2,How To Register a Business Name,"Finding a business name is, well, serious business. You want something that will grow as your company does. While you can rebrand with a new name down the line, you'll save time, money, and confusion for clients by finding a business name to stick with for as long as possible.

But you can't just slap a sign on a website or building and call it a day. For legal and tax purposes, you typically have to register your business name. Unless you are a sole proprietor operating under your own name, you'll need to work with local, state, and federal agencies to register your business name.",https://blog.hubspot.com/sales/how-to-register-a-business-name,19-10-2021 11:00,business
3,"PDF Download*% Essential Statistics for Economics, Business and Manag…","Upcoming SlideShare What to Upload to SlideShare 
 Download to read offline and view in fullscreen. Author : by {""isAjaxInProgress_B001HCVKSG"":""0"",""isAjaxComplete_B001HCVKSG"":""0""} Teresa Bradley (Author) › Visit Amazon's Teresa Bradley Page Find all the books, read about the author, and more. See search results for this author Are you an author? Learn about Author Central Teresa Bradley (Author) Read Or Download => https://pdfupdates.com/0470850795 Essential Statistics for Economics, Business an",https://www.slideshare.net/nasirmckinley/pdf-download-essential-statistics-for-economics-business-and-management-read-book-epub,22-10-2021 03:32,news
4,"NBA, LegalZoom Team Up To Provide $6 Million In Support To Small Business Owners","The National Basketball Association (NBA) and LegalZoom, an online platform for legal services are teaming up to create 'Fast Break for Small Businesses.'

The Fast Break for Small Businesses Initiative will award $6 million in grants and LegalZoom services to support thousands of small businesses across the country. The initiative plans to change the game by removing barriers minorities, women, immigrants and the LGBTQ face trying to start and maintain a small business.

Former NBA All-Star Grant Hill is serving as an ambassador to the Fast Break for Small Business initiative believes LegalZoom and the NBA is working to help small business owners.",https://news.yahoo.com/nba-legalzoom-team-6-million-001043329.html,16-10-2021 00:10,news
5,MX Introduces MXdata For Business,"LEHI, Utah, Oct. 20, 2021 /PRNewswire/ -- MX, the financial data platform and leader in modern connectivity, today announced MXdata for Business. Built on MX's industry-leading financial data platform, MXdata for Business enhances business transaction data with cleansed descriptions, business-specific categories, classifiers, merchant logos, location data, and more. MXdata for Business provides a more holistic data solution for organizations interacting with small and midsize businesses (SMBs)—which increases the effectiveness of existing revenue streams, and simultaneously identifies new revenue opportunities.",https://apnews.com/press-release/pr-newswire/cb0d613b19c1fc3280c55de5b232415b,20-10-2021 15:21,news
6,Business Loan vs. Personal Loan: Which Is Best?,"For many companies and individuals, getting a loan can be a viable option to get access to immediate cash for both business and personal needs. However, there is no one-size-fits-all type of loan.
 
Whether you are a seasoned entrepreneur with a business in a cash crunch, or a new contractor looking for capital to take your business off the ground, you need to consider your financial needs to understand which type of loan is right for you.
 
Business loans provide capital for growing your company while personal loans can be used for nearly any purpose.",https://www.thebalance.com/business-loan-vs-personal-loan-which-is-best-5206434,20-10-2021 13:43,business
7,Sound Business Financial Literacy Skills Will Set Your Company Up For Profit,"What do you think is more important in business – sales or profit? It's a trick question because, without sales, there would be no profit in a business. However, without consistent profit in a company, there would be no business. As a business owner, there are many hats you need to wear, including the hat of a financial person. Smiling business woman getty You do not need to be an accountant, you do not need to do your bookkeeping, but if you are the CEO of your business, you need a high-level understanding of your business finances.",https://www.forbes.com/sites/melissahouston/2021/10/20/sound-business-financial-literacy-skills-will-set-your-company-up-for-profit/,20-10-2021 09:00,business
8,"Download In %PDF Demand Management Best Practices: Process, Principle…","Upcoming SlideShare What to Upload to SlideShare 
 Download to read offline and view in fullscreen. Author : by {""isAjaxComplete_B001K7T030"":""0"",""isAjaxInProgress_B001K7T030"":""0""} Colleen Crum (Author) › Visit Amazon's Colleen Crum Page Find all the books, read about the author, and more. See search results for this author Are you an author? Learn about Author Central Colleen Crum (Author), George Palmatier (Author) Read Or Download => https://bookslow.com/1932159010 Demand Management Best Pract",https://www.slideshare.net/AllysonSoto1/download-in-pdf-demand-management-best-practices-process-principles-and-collaboration-integrated-business-management-read-book-epub-250498001,22-10-2021 03:32,news
9,Online business school accreditation: What you need to know,"Accreditation indicates a school or program meets the standards established by the accrediting body. Colleges and universities hold regional or national accreditation, a designation that extends to on-campus and online offerings. Within institutions, individual departments and degrees may hold additional programmatic accreditations. For online business schools, programmatic accreditation comes from one of three professional bodies. Each accreditor certifies the academic quality of business degrees based on its own criteria for quality and excellence.",https://www.zdnet.com/article/online-business-school-accreditation/,22-10-2021 17:19,news
10,MX Introduces MXdata For Business,"""The needs and expectations of small businesses have evolved to require more technical product offerings to help them better manage their finances and grow their business,"" said Brett Allred, Chief Product Officer, MX. ""Once they get access to standardized, actionable data, organizations can track and measure performance gaps, identify new areas of investment, and develop profiles for their business customers. As a former small business owner, I know that accurate and insightful financial data is essential to grow a business.",https://www.prnewswire.com/news-releases/mx-introduces-mxdata-for-business-301404229.html,20-10-2021 14:03,news
11,Business courses online: Grow your business skills from home,"Whether you already work in business, want to transition into the field, or aspire to be your own boss, online business courses teach the skills to succeed, which you can learn from the comfort of your own home.Business courses online range from introductory to advanced, designed to accommodate your busy schedule. Taking online business classes also gives you an opportunity to explore the world of business and decide if a degree in the discipline is in your future. Should I take business courses online or pursue an MBA?If you want a quick, flexible, and affordable option for learning business skills, you should take business courses online.",https://www.zdnet.com/article/business-courses-overview/,21-10-2021 18:43,business
12,How supply chain disruptions are affecting Columbia Sportswear's business,"How supply chain disruptions are affecting Columbia Sportswear's business NPR's Michel Martin speaks with Columbia Sportswear CEO Tim Boyle about how recent supply chain issues have challenged his company.

Business How supply chain disruptions are affecting Columbia Sportswear's business How supply chain disruptions are affecting Columbia Sportswear's business Listen · 3:53 3:53 NPR's Michel Martin speaks with Columbia Sportswear CEO Tim Boyle about how recent supply chain issues have challenged his company.",https://www.npr.org/2021/10/17/1046905239/how-supply-chain-disruptions-are-affecting-columbia-sportswears-business,17-10-2021 21:04,news
13,Associate degrees in business administration: What to expect,"Whether you're a high school graduate or working professional, starting your higher education is a major career decision. This business administration associate degree guide explores online and traditional programs, course requirements, and hands-on learning opportunities and internships. It also goes over important soft and hard skills for business leaders seeking career advancement. What is an associate degree in business administration?An associate degree in business administration is the foundation of gaining a global understanding of business fundamentals.",https://www.zdnet.com/article/business-administration-associate/,22-10-2021 00:31,tech
14,Wells Fargo Business Secured Credit Card review 2021,"View now Business credit is difficult to get until a company is well established. In most cases, business founders need to put up their personal assets (and credit score) to get approved for a business line of credit. Entrepreneurs may not want to risk their personal credit for their company -- or may not even be able to, due to poor credit. The Wells Fargo Business Secured Credit Card is one of the few card options available for small businesses wanting to build credit while supplementing cash flow.",https://www.zdnet.com/article/wells-fargo-business-secured-credit-card-review/,21-10-2021 03:00,news
15,5 Important Factors To Consider Before Selling Your Business,"There are many reasons why people might choose to sell a business. Sometimes, they don't have enough time to continue investing, are ready to cash out, or simply have decided to focus on other parts of their life. Even when someone is not quite ready to sell their business today, it's crucial to have a structure in place for doing so and this will greatly improve the day-to-day operations.

It's much more difficult to make substantial changes the further along a business develops, so starting off early on with the proper structure is crucial.",https://www.forbes.com/sites/mikeswigunski/2021/10/22/5-important-factors-to-consider-before-selling-your-business,22-10-2021 14:30,business
16,Everything Marketers Should Know About Facebook Business Suite,"If you're managing social accounts on Facebook, Instagram, or both, you can likely benefit from the management dashboard that is Facebook Business Suite.
This free tool offers some powerful features for professional users. It can't tackle all of your daily social media needs, but it can help a lot. Let's look at how Facebook Business Suite can help your business and when you might need to add other tools into the mix. Bonus: Get a free social media analytics report template that shows you the most important metrics to track for each network.",https://blog.hootsuite.com/?p=295741,19-10-2021 19:00,news
17,"Chase Ink Business Unlimited Review: Good Choice for Simple, 1.5% Cash Back Business Rewards","We want to help you make more informed decisions. Some links on this page — clearly marked — may take you to a partner website and may result in us earning a referral commission. For more information, see How We Make Money.   Terms apply to American Express benefits and offers. Enrollment may be required for some American Express benefits and offers. Visit americanexpress.com to learn more. Ink Business Unlimited® Credit Card Editor's Score: (N/A)Last updated October 22, 2021All reviews are prepared by NextAdvisor staff.",https://time.com/nextadvisor/credit-cards/chase/ink-business-unlimited-credit-card-review/,22-10-2021 10:30,news
18,5 Steps You Can Take to Start a Small Town Business,"Opinions expressed by Entrepreneur contributors are their own. There are many different kinds of entrepreneurs. Some are drawn to a business just because of an innate passion for what they are doing, some are bred into it and others discovered a problem and want to create a solution for that problem in the marketplace. For those who want to start a business in the small-town communities  — how can you make sure you do it right?Related: Who Is an EntrepreneurIdentifying a gap in a small town is as simple as a Google search followed by taking a walk.",https://www.entrepreneur.com/article/380261,16-10-2021 21:00,business
19,Bank of America Launches Business Advantage Unlimited Cash Rewards Card for Entrepreneurs,"CHARLOTTE, N.C., Oct. 21, 2021 /PRNewswire/ -- Bank of America today announced the launch of the Business Advantage Unlimited Cash Rewards card. This new card allows small business owners to earn unlimited 1.5% cash back on all purchases. Cash rewards don't expire, and redemption is simple: small business clients can redeem their cash back for any amount, at any time for statement credits or deposits directly into a Bank of America checking or savings account, or for credit to an eligible Merrill account.",https://www.prnewswire.com/news-releases/bank-of-america-launches-business-advantage-unlimited-cash-rewards-card-for-entrepreneurs-301405640.html,21-10-2021 13:00,finance
20,Bank of America Launches Business Advantage Unlimited Cash Rewards Card for Entrepreneurs,"Preferred Rewards for Business Members Earn 25% to 75% More Cash Back on Every Purchase; New Payments and Invoicing Solution also among Latest Innovations for Small Business Clients

CHARLOTTE, N.C., Oct. 21, 2021 /PRNewswire/ -- Bank of America today announced the launch of the Business Advantage Unlimited Cash Rewards card. This new card allows small business owners to earn unlimited 1.5% cash back on all purchases. Cash rewards don't expire, and redemption is simple: small business clients can redeem their cash back for any amount, at any time for statement credits or deposits directly into a Bank of America checking or savings account, or for credit to an eligible Merrill account.",https://finance.yahoo.com/news/bank-america-launches-business-advantage-130000420.html,21-10-2021 13:00,finance
21,Best Startup Business Loans Ultimate Guide 2021,"Getting a small business loan can be challenging if your company doesn't have an established history of success. However, there are several types of startup loans that are suited to a range of needs and qualifications.
Online Term Loans
Term loans are typically available through traditional banks and online lenders; however, banks may require more qualification requirements than online lenders. Term loans from online lenders generally have maximum limits between $250,000 and $500,000, but newly established startups likely won't qualify for loan amounts that high.",https://www.forbes.com/advisor/business-loans/best-startup-business-loans/,20-10-2021 16:07,news
22,Bank of America Business Advantage Customized Cash Rewards credit card review,"Gig workers, freelancers, small business owners and anyone starting a business should consider having a business credit card to separate their personal expenses from company-related ones. This Bank of America Business Advantage Customized Cash Rewards credit card review explores the card as an option.Even if you don't have established business credit, you could apply and get a business credit card using your personal credit. The Bank of America Business Advantage Customized Cash Rewards credit card could earn you the most cash back when the bulk of your company spending occurs in one type of category.",https://www.zdnet.com/article/bank-of-america-business-advantage-customized-cash-rewards-card-review/,21-10-2021 01:00,tech
23,The Cost & Importance of Small Business Insurance,"No matter the industry, small businesses need to protect their work and assets. While small business insurance can seem like a burden, it's an important part of doing business. But how much should you be paying for business insurance? And how can you be sure your investments are properly protecting you?

Your small business insurance costs will vary based on factors like your preferred type of coverage and industry. If you're searching for small business insurance, knowing some common prices for your line of work can help you navigate the various quotes you receive to choose the best policy and company for you.",https://blog.hubspot.com/sales/small-business-insurance-cost,22-10-2021 11:00,business
24,"Gartner Survey of Over 2,000 CIOs Reveals the Need for Enterprises to Embrace Business Composability in 2022","October 18, 2021 02:00 PM Eastern Daylight Time STAMFORD, Conn.--(BUSINESS WIRE)--Enterprises must embrace business composability to thrive through disruption in 2022 and beyond, according to Gartner, Inc.'s annual global survey of CIOs and technology executives.



Business composability is the mindset, technologies, and set of operating capabilities that enable organizations to innovate and adapt quickly to changing business needs. It is built on applying the key principle of modularity to business assets to achieve the scale and pace required of business ambition.",https://www.businesswire.com/news/home/20211018005875/en/Gartner-Survey-of-Over-2000-CIOs-Reveals-the-Need-for-Enterprises-to-Embrace-Business-Composability-in-2022,18-10-2021 18:00,tech
25,"Global Spectator Sports Market Report 2021 Featuring FC Barcelona, Dallas Cowboys, Real Madrid, Manchester United, & New York Yankees","Dublin, Oct. 20, 2021 (GLOBE NEWSWIRE) -- The ""Spectator Sports Global Market Opportunities and Strategies to 2030: COVID-19 Impact and Recovery"" report has been added to ResearchAndMarkets.com's offering. The global sports market, of which the spectator sports market is a segment, reached a value of nearly $94,435.9 million in 2020, having declined at -2.1% since 2015. It is expected to grow at a compound annual growth rate (CAGR) of 16.3% to reach nearly $200,878.0 million by 2025. The participatory sports market was the largest segment in the global sports, accounting for 72.",https://www.globenewswire.com/news-release/2021/10/20/2317073/28124/en/Global-Spectator-Sports-Market-Report-2021-Featuring-FC-Barcelona-Dallas-Cowboys-Real-Madrid-Manchester-United-New-York-Yankees.html,20-10-2021 00:00,news
26,"Global $200 Billion Spectator Sports Markets Analysis & Forecasts, 2015-2020 & 2021-2030","DUBLIN, Oct. 20, 2021 /PRNewswire/ -- The ""Spectator Sports Global Market Opportunities and Strategies to 2030: COVID-19 Impact and Recovery"" report has been added to ResearchAndMarkets.com's offering.
The global sports market, of which the spectator sports market is a segment, reached a value of nearly $94,435.9 million in 2020, having declined at -2.1% since 2015. It is expected to grow at a compound annual growth rate (CAGR) of 16.3% to reach nearly $200,878.0 million by 2025. The participatory sports market was the largest segment in the global sports, accounting for 72.",https://www.prnewswire.com/news-releases/global-200-billion-spectator-sports-markets-analysis--forecasts-2015-2020--2021-2030-301404436.html,20-10-2021 11:00,news
27,Spectator Sports Global Market Opportunities and Strategies to 2030: COVID-19 Impact and Recovery,"October 20, 2021 06:47 AM Eastern Daylight Time DUBLIN--(BUSINESS WIRE)--The ""Spectator Sports Global Market Opportunities and Strategies to 2030: COVID-19 Impact and Recovery"" report has been added to ResearchAndMarkets.com's offering.



The global sports market, of which the spectator sports market is a segment, reached a value of nearly $94,435.9 million in 2020, having declined at -2.1% since 2015. It is expected to grow at a compound annual growth rate (CAGR) of 16.3% to reach nearly $200,878.",https://www.businesswire.com/news/home/20211020005539/en/Spectator-Sports-Global-Market-Opportunities-and-Strategies-to-2030-COVID-19-Impact-and-Recovery---ResearchAndMarkets.com,20-10-2021 10:47,news
28,"Global Spectator Sports Market Report 2021 Featuring FC Barcelona, Dallas Cowboys, Real Madrid, Manchester United, & New York Yankees","Dublin, Oct. 20, 2021 (GLOBE NEWSWIRE) -- The ""Spectator Sports Global Market Opportunities and Strategies to 2030: COVID-19 Impact and Recovery"" report has been added to ResearchAndMarkets.com's offering.

The global sports market, of which the spectator sports market is a segment, reached a value of nearly $94,435.9 million in 2020, having declined at -2.1% since 2015. It is expected to grow at a compound annual growth rate (CAGR) of 16.3% to reach nearly $200,878.0 million by 2025. The participatory sports market was the largest segment in the global sports, accounting for 72.",https://finance.yahoo.com/news/global-spectator-sports-market-report-080300130.html,20-10-2021 08:03,news
29,Fosun Sports Group announces new entity to deepen global sports industry footprint,"HONG KONG, Oct. 19, 2021 /PRNewswire/ -- On October 19, 2021, Fosun Sports Group (hereinafter referred to as 'Fosun Sports'), a global pan-sports industry operating group company and subsidiary of Fosun International's happiness segment, announced the formal establishment of Fosun Sports as a holding entity, and the acquisition of core operating assets and management team of Foyo, in games, esports and sports. At the same time, Fosun Sports has received a minority strategic investment from the U.",https://finance.yahoo.com/news/fosun-sports-group-announces-entity-090000050.html,19-10-2021 09:00,gaming
30,Fosun Sports Group announces new entity to deepen global sports industry footprint,"HONG KONG, Oct. 19, 2021 /PRNewswire/ -- On October 19, 2021, Fosun Sports Group (hereinafter referred to as 'Fosun Sports'), a global pan-sports industry operating group company and subsidiary of Fosun International's happiness segment, announced the formal establishment of Fosun Sports as a holding entity, and the acquisition of core operating assets and management team of Foyo, in games, esports and sports. At the same time, Fosun Sports has received a minority strategic investment from the U.",https://www.prnewswire.com/news-releases/fosun-sports-group-announces-new-entity-to-deepen-global-sports-industry-footprint-301403059.html,19-10-2021 09:00,news
31,SBLive Sports Announces Partnership with Sports Illustrated Media Group,"SPOKANE, Wash., Oct. 18, 2021 /PRNewswire/ -- SBLive Sports ( www.scorebooklive.com ), the fastest-growing high school sports media company in the nation, has entered into a partnership with The Arena Group under the fastest-growing sports media property globally, Sports Illustrated Media Group.

SBLive Sports announces partnership with Sports Illustrated Media Group.

After emerging as a leading destination for high school sports fans in California, Texas, Washington, Mississippi, Arkansas, Georgia, Oregon and other states, SBLive Sports is joining the collective vertical of online sports brands anchored by Sports Illustrated , recently ranked No.",https://finance.yahoo.com/news/sblive-sports-announces-partnership-sports-190000317.html,18-10-2021 19:00,gaming
32,FanClub Sports Finally Announces its Long-Awaited Public Launch,"TORONTO and MADRID, Oct. 18, 2021 /PRNewswire/ -- Co-Founders David Mirynech, Mate Kovacs & Brian Leiberman are proud to announce the launch of FanClub Sports (FanClub). 
Headquartered in Toronto, Canada, with offices in Madrid, Spain, FanClub Sports is a sports investment platform and community that democratizes access to investing in pro sports. FanClub provides team owners and limited partners (LPs) with financing and liquidity while giving investors and fans a chance to own professional sports clubs.",https://www.prnewswire.com/news-releases/fanclub-sports-finally-announces-its-long-awaited-public-launch-301401795.html,18-10-2021 15:00,business
