sno,title,summary,link,pub_date,topic
105,MX Introduces MXdata For Business,"LEHI, Utah, Oct. 20, 2021 /PRNewswire/ -- MX, the financial data platform and leader in modern connectivity, today announced MXdata for Business. Built on MX's industry-leading financial data platform, MXdata for Business enhances business transaction data with cleansed descriptions, business-specific categories, classifiers, merchant logos, location data, and more. MXdata for Business provides a more holistic data solution for organizations interacting with small and midsize businesses (SMBs)—which increases the effectiveness of existing revenue streams, and simultaneously identifies new revenue opportunities.",https://apnews.com/press-release/pr-newswire/cb0d613b19c1fc3280c55de5b232415b,20-10-2021 15:21,news
106,Business Loan vs. Personal Loan: Which Is Best?,"For many companies and individuals, getting a loan can be a viable option to get access to immediate cash for both business and personal needs. However, there is no one-size-fits-all type of loan.
 
Whether you are a seasoned entrepreneur with a business in a cash crunch, or a new contractor looking for capital to take your business off the ground, you need to consider your financial needs to understand which type of loan is right for you.
 
Business loans provide capital for growing your company while personal loans can be used for nearly any purpose.",https://www.thebalance.com/business-loan-vs-personal-loan-which-is-best-5206434,20-10-2021 13:43,business
107,Sound Business Financial Literacy Skills Will Set Your Company Up For Profit,"What do you think is more important in business – sales or profit? It's a trick question because, without sales, there would be no profit in a business. However, without consistent profit in a company, there would be no business. As a business owner, there are many hats you need to wear, including the hat of a financial person. Smiling business woman getty You do not need to be an accountant, you do not need to do your bookkeeping, but if you are the CEO of your business, you need a high-level understanding of your business finances.",https://www.forbes.com/sites/melissahouston/2021/10/20/sound-business-financial-literacy-skills-will-set-your-company-up-for-profit/,20-10-2021 09:00,business
108,"Download In %PDF Demand Management Best Practices: Process, Principle…","Upcoming SlideShare What to Upload to SlideShare 
 Download to read offline and view in fullscreen. Author : by {""isAjaxComplete_B001K7T030"":""0"",""isAjaxInProgress_B001K7T030"":""0""} Colleen Crum (Author) › Visit Amazon's Colleen Crum Page Find all the books, read about the author, and more. See search results for this author Are you an author? Learn about Author Central Colleen Crum (Author), George Palmatier (Author) Read Or Download => https://bookslow.com/1932159010 Demand Management Best Pract",https://www.slideshare.net/AllysonSoto1/download-in-pdf-demand-management-best-practices-process-principles-and-collaboration-integrated-business-management-read-book-epub-250498001,22-10-2021 03:32,news
109,Online business school accreditation: What you need to know,"Accreditation indicates a school or program meets the standards established by the accrediting body. Colleges and universities hold regional or national accreditation, a designation that extends to on-campus and online offerings. Within institutions, individual departments and degrees may hold additional programmatic accreditations. For online business schools, programmatic accreditation comes from one of three professional bodies. Each accreditor certifies the academic quality of business degrees based on its own criteria for quality and excellence.",https://www.zdnet.com/article/online-business-school-accreditation/,22-10-2021 17:19,news
110,MX Introduces MXdata For Business,"""The needs and expectations of small businesses have evolved to require more technical product offerings to help them better manage their finances and grow their business,"" said Brett Allred, Chief Product Officer, MX. ""Once they get access to standardized, actionable data, organizations can track and measure performance gaps, identify new areas of investment, and develop profiles for their business customers. As a former small business owner, I know that accurate and insightful financial data is essential to grow a business.",https://www.prnewswire.com/news-releases/mx-introduces-mxdata-for-business-301404229.html,20-10-2021 14:03,news
111,Business courses online: Grow your business skills from home,"Whether you already work in business, want to transition into the field, or aspire to be your own boss, online business courses teach the skills to succeed, which you can learn from the comfort of your own home.Business courses online range from introductory to advanced, designed to accommodate your busy schedule. Taking online business classes also gives you an opportunity to explore the world of business and decide if a degree in the discipline is in your future. Should I take business courses online or pursue an MBA?If you want a quick, flexible, and affordable option for learning business skills, you should take business courses online.",https://www.zdnet.com/article/business-courses-overview/,21-10-2021 18:43,business
112,How supply chain disruptions are affecting Columbia Sportswear's business,"How supply chain disruptions are affecting Columbia Sportswear's business NPR's Michel Martin speaks with Columbia Sportswear CEO Tim Boyle about how recent supply chain issues have challenged his company.

Business How supply chain disruptions are affecting Columbia Sportswear's business How supply chain disruptions are affecting Columbia Sportswear's business Listen · 3:53 3:53 NPR's Michel Martin speaks with Columbia Sportswear CEO Tim Boyle about how recent supply chain issues have challenged his company.",https://www.npr.org/2021/10/17/1046905239/how-supply-chain-disruptions-are-affecting-columbia-sportswears-business,17-10-2021 21:04,news
113,Associate degrees in business administration: What to expect,"Whether you're a high school graduate or working professional, starting your higher education is a major career decision. This business administration associate degree guide explores online and traditional programs, course requirements, and hands-on learning opportunities and internships. It also goes over important soft and hard skills for business leaders seeking career advancement. What is an associate degree in business administration?An associate degree in business administration is the foundation of gaining a global understanding of business fundamentals.",https://www.zdnet.com/article/business-administration-associate/,22-10-2021 00:31,tech
114,Wells Fargo Business Secured Credit Card review 2021,"View now Business credit is difficult to get until a company is well established. In most cases, business founders need to put up their personal assets (and credit score) to get approved for a business line of credit. Entrepreneurs may not want to risk their personal credit for their company -- or may not even be able to, due to poor credit. The Wells Fargo Business Secured Credit Card is one of the few card options available for small businesses wanting to build credit while supplementing cash flow.",https://www.zdnet.com/article/wells-fargo-business-secured-credit-card-review/,21-10-2021 03:00,news
115,5 Important Factors To Consider Before Selling Your Business,"There are many reasons why people might choose to sell a business. Sometimes, they don't have enough time to continue investing, are ready to cash out, or simply have decided to focus on other parts of their life. Even when someone is not quite ready to sell their business today, it's crucial to have a structure in place for doing so and this will greatly improve the day-to-day operations.

It's much more difficult to make substantial changes the further along a business develops, so starting off early on with the proper structure is crucial.",https://www.forbes.com/sites/mikeswigunski/2021/10/22/5-important-factors-to-consider-before-selling-your-business,22-10-2021 14:30,business
116,Everything Marketers Should Know About Facebook Business Suite,"If you're managing social accounts on Facebook, Instagram, or both, you can likely benefit from the management dashboard that is Facebook Business Suite.
This free tool offers some powerful features for professional users. It can't tackle all of your daily social media needs, but it can help a lot. Let's look at how Facebook Business Suite can help your business and when you might need to add other tools into the mix. Bonus: Get a free social media analytics report template that shows you the most important metrics to track for each network.",https://blog.hootsuite.com/?p=295741,19-10-2021 19:00,news
117,"Chase Ink Business Unlimited Review: Good Choice for Simple, 1.5% Cash Back Business Rewards","We want to help you make more informed decisions. Some links on this page — clearly marked — may take you to a partner website and may result in us earning a referral commission. For more information, see How We Make Money.   Terms apply to American Express benefits and offers. Enrollment may be required for some American Express benefits and offers. Visit americanexpress.com to learn more. Ink Business Unlimited® Credit Card Editor's Score: (N/A)Last updated October 22, 2021All reviews are prepared by NextAdvisor staff.",https://time.com/nextadvisor/credit-cards/chase/ink-business-unlimited-credit-card-review/,22-10-2021 10:30,news
118,5 Steps You Can Take to Start a Small Town Business,"Opinions expressed by Entrepreneur contributors are their own. There are many different kinds of entrepreneurs. Some are drawn to a business just because of an innate passion for what they are doing, some are bred into it and others discovered a problem and want to create a solution for that problem in the marketplace. For those who want to start a business in the small-town communities  — how can you make sure you do it right?Related: Who Is an EntrepreneurIdentifying a gap in a small town is as simple as a Google search followed by taking a walk.",https://www.entrepreneur.com/article/380261,16-10-2021 21:00,business
119,Bank of America Launches Business Advantage Unlimited Cash Rewards Card for Entrepreneurs,"CHARLOTTE, N.C., Oct. 21, 2021 /PRNewswire/ -- Bank of America today announced the launch of the Business Advantage Unlimited Cash Rewards card. This new card allows small business owners to earn unlimited 1.5% cash back on all purchases. Cash rewards don't expire, and redemption is simple: small business clients can redeem their cash back for any amount, at any time for statement credits or deposits directly into a Bank of America checking or savings account, or for credit to an eligible Merrill account.",https://www.prnewswire.com/news-releases/bank-of-america-launches-business-advantage-unlimited-cash-rewards-card-for-entrepreneurs-301405640.html,21-10-2021 13:00,finance
120,Bank of America Launches Business Advantage Unlimited Cash Rewards Card for Entrepreneurs,"Preferred Rewards for Business Members Earn 25% to 75% More Cash Back on Every Purchase; New Payments and Invoicing Solution also among Latest Innovations for Small Business Clients

CHARLOTTE, N.C., Oct. 21, 2021 /PRNewswire/ -- Bank of America today announced the launch of the Business Advantage Unlimited Cash Rewards card. This new card allows small business owners to earn unlimited 1.5% cash back on all purchases. Cash rewards don't expire, and redemption is simple: small business clients can redeem their cash back for any amount, at any time for statement credits or deposits directly into a Bank of America checking or savings account, or for credit to an eligible Merrill account.",https://finance.yahoo.com/news/bank-america-launches-business-advantage-130000420.html,21-10-2021 13:00,finance
121,Best Startup Business Loans Ultimate Guide 2021,"Getting a small business loan can be challenging if your company doesn't have an established history of success. However, there are several types of startup loans that are suited to a range of needs and qualifications.
Online Term Loans
Term loans are typically available through traditional banks and online lenders; however, banks may require more qualification requirements than online lenders. Term loans from online lenders generally have maximum limits between $250,000 and $500,000, but newly established startups likely won't qualify for loan amounts that high.",https://www.forbes.com/advisor/business-loans/best-startup-business-loans/,20-10-2021 16:07,news
122,Bank of America Business Advantage Customized Cash Rewards credit card review,"Gig workers, freelancers, small business owners and anyone starting a business should consider having a business credit card to separate their personal expenses from company-related ones. This Bank of America Business Advantage Customized Cash Rewards credit card review explores the card as an option.Even if you don't have established business credit, you could apply and get a business credit card using your personal credit. The Bank of America Business Advantage Customized Cash Rewards credit card could earn you the most cash back when the bulk of your company spending occurs in one type of category.",https://www.zdnet.com/article/bank-of-america-business-advantage-customized-cash-rewards-card-review/,21-10-2021 01:00,tech
123,The Cost & Importance of Small Business Insurance,"No matter the industry, small businesses need to protect their work and assets. While small business insurance can seem like a burden, it's an important part of doing business. But how much should you be paying for business insurance? And how can you be sure your investments are properly protecting you?

Your small business insurance costs will vary based on factors like your preferred type of coverage and industry. If you're searching for small business insurance, knowing some common prices for your line of work can help you navigate the various quotes you receive to choose the best policy and company for you.",https://blog.hubspot.com/sales/small-business-insurance-cost,22-10-2021 11:00,business
124,"Gartner Survey of Over 2,000 CIOs Reveals the Need for Enterprises to Embrace Business Composability in 2022","October 18, 2021 02:00 PM Eastern Daylight Time STAMFORD, Conn.--(BUSINESS WIRE)--Enterprises must embrace business composability to thrive through disruption in 2022 and beyond, according to Gartner, Inc.'s annual global survey of CIOs and technology executives.



Business composability is the mindset, technologies, and set of operating capabilities that enable organizations to innovate and adapt quickly to changing business needs. It is built on applying the key principle of modularity to business assets to achieve the scale and pace required of business ambition.",https://www.businesswire.com/news/home/20211018005875/en/Gartner-Survey-of-Over-2000-CIOs-Reveals-the-Need-for-Enterprises-to-Embrace-Business-Composability-in-2022,18-10-2021 18:00,tech
