sno,title,summary,link,pub_date,topic
33,Sports Innovation Lab Announces Creation of Women's Sports Leadership...,"Sports Innovation Lab's Women's Sports Leadership Board The Women's Sports Leadership Board is a landmark step in the growth of women's sports.

Sports Innovation Lab, a data-driven fan intelligence company, announced today at the 2021 espnW: Women + Sports Summit the formation of the Women's Sports Leadership Board, bringing together leading executives from leagues, media networks, brands, retailers, and other influential properties from across the sports landscape. The board is the first of its kind, specifically dedicated to accelerating the growth and commercialization of women's sports.",https://www.prweb.com/releases/sports_innovation_lab_announces_creation_of_womens_sports_leadership_board_at_espnw_women_sports_summit/prweb18275393.htm,19-10-2021 00:00,tech
34,Global Sports Software (Management) Market Share Projected to Reach USD 13.6 Billion by 2026: Facts & Factors,"New York, NY, Oct. 20, 2021 (GLOBE NEWSWIRE) -- Facts and Factors have published a new research report titled 'Sports Software Market By Deployment Mode (Cloud-Based Deployment & On-Premises Deployment), By Application (Event Management & Scheduling, Team Management, Marketing Management, Client Management, Others), And By Regions - Global & Regional Industry Perspective, Comprehensive Analysis, and Forecast 2021 - 2026' in its research database 'According to the report, the global sports software market was valued at approximately USD 5.",https://www.globenewswire.com/news-release/2021/10/20/2317423/0/en/Global-Sports-Software-Management-Market-Share-Projected-to-Reach-USD-13-6-Billion-by-2026-Facts-Factors.html,20-10-2021 00:00,news
35,Insights on the Sports Mouthguard Global Market to 2028,"DUBLIN, Oct. 21, 2021 /PRNewswire/ --The ""Global Sports Mouthguard Market Forecast to 2028 - COVID-19 Impact and Global Analysis By Product (Stock Mouthguard, Boil and Bite Mouthguard, Custom Made Mouthguard, Smart Mouthguards); Distribution Channel (Offline, Online), and Geography"" report has been added to ResearchAndMarkets.com's offering. 
The sports mouthguard market is expected to reach US$ 4,958.90 million by 2028 from US$ 2,419.89 million in 2021; it is estimated to grow at a CAGR of 10.8% from 2021 to 2028.",https://www.prnewswire.com/news-releases/insights-on-the-sports-mouthguard-global-market-to-2028---by-product-distribution-channel-and-geography-301405683.html,21-10-2021 15:45,news
36,Ensuring Community Sports Programs Survive and Keeping Your Kids Active,"Olympic Gold Medalist Benita Fitzgerald Mosley Discusses the Importance of Organized Sports for Every Kid, Family and Community

New York, New York --News Direct-- YourUpdateTV

Similar to so many other small business owners (restaurants, shops and other local services), the leaders running youth sports programs have faced an evolving multitude of challenges over the past 20 months as the pandemic continues to impact both the programs and the kids they serve. Recently, Olympic Gold Medalist Benita Fitzgerald Mosley participated in a nationwide satellite media tour to discuss the importance of organized sports for every kid, family and community.",https://finance.yahoo.com/news/ensuring-community-sports-programs-survive-154000821.html,22-10-2021 15:40,news
37,"First sports equinox arrives: NFL, NBA, MLB, NHL all play in October after thrilling WNBA Finals","The holiday season is fast approaching, but for sports fans, it's already the most wonderful time of the year. October means the sports calendar is in full swing. The WNBA recently wrapped a thrilling final on Sunday. Major League Baseball is completing its pennant races ahead of the World Series starting next week. The NHL returned last week and the NBA returned to its normal calendar with teams opening this week. The college football season is halfway through and the NFL rolls on with Week 7.  With these sports all aligning on Thursday, the phenomenon known as ""sports equinox"" has arrived.",https://www.usatoday.com/story/sports/2021/10/21/sports-equinox-2021-nba-nfl-mlb-nhl/8537655002/,21-10-2021 10:06,news
38,Online sports betting launches in Connecticut on Tuesday,"Wannabe Massachusetts sports bettors now have a new state border they can cross to place a bet using their phone, as Connecticut launched online wagering Tuesday both for sports betting and casino games.The Massachusetts Legislature is still hashing out potential sports betting legislation with no bill expected to be sent out in the immediate future.DraftKings is partnering with Foxwoods Resort Casino, FanDuel with Mohegan Sun and PlaySugarHouse with the state lottery. Now, anyone 21 years or older can drive into the Nutmeg State and place a sports bet or play some blackjack by the side of the road.",https://www.bostonglobe.com/2021/10/19/sports/online-sports-betting-launches-connecticut-tuesday/,19-10-2021 17:25,news
39,Global Sports Mouthguard Market (2021 to 2028),"Dublin, Oct. 21, 2021 (GLOBE NEWSWIRE) -- The ""Global Sports Mouthguard Market Forecast to 2028 - COVID-19 Impact and Global Analysis By Product (Stock Mouthguard, Boil and Bite Mouthguard, Custom Made Mouthguard, Smart Mouthguards); Distribution Channel (Offline, Online), and Geography"" report has been added to ResearchAndMarkets.com's offering. The sports mouthguard market is expected to reach US$ 4,958.90 million by 2028 from US$ 2,419.89 million in 2021; it is estimated to grow at a CAGR of 10.",https://www.globenewswire.com/news-release/2021/10/21/2318117/28124/en/Global-Sports-Mouthguard-Market-2021-to-2028-Featuring-Shock-Doctor-MOGO-Sport-and-Brain-Pad-Among-Others.html,21-10-2021 00:00,news
40,SBLive Sports Announces Partnership with Sports Illustrated Media Group,"After emerging as a leading destination for high school sports fans in California, Texas, Washington, Mississippi, Arkansas, Georgia, Oregon and other states, SBLive Sports is joining the collective vertical of online sports brands anchored by Sports Illustrated, recently ranked No. 6 across Comscore sports media with more than 42 million monthly users.

SBLive's original content includes national football and basketball rankings, athlete of the week features across more than a dozen states, podcasts, player profiles and more.",https://www.prnewswire.com/news-releases/sblive-sports-announces-partnership-with-sports-illustrated-media-group-301402536.html,18-10-2021 19:00,business
41,Amendment stresses physical education,"By Sun Xiaochen | China Daily | Updated: 2021-10-20 09:44 Share - WeChat Pupils run on the playground at a primary school in Longnan city, Northwest China's Gansu province, on Aug 31, 2020. [Photo/Xinhua] An amendment to China's sports law that emphasizes physical education, the sports industry and combating doping is expected to help the country further develop into an international sports power. The draft revision of the Law on Physical Culture and Sports, which was submitted to China's top legislature on Tuesday for first review, outlines updated requirements for guaranteeing enough sports participation by students on campuses, measures to promote the balanced development of the sports industry and new measures to prevent doping in sports.",https://www.chinadaily.com.cn/a/202110/20/WS616f7494a310cdd39bc7004d.html,20-10-2021 02:30,news
42,Global Sports Mouthguard Market (2021 to 2028),"Dublin, Oct. 21, 2021 (GLOBE NEWSWIRE) -- The ""Global Sports Mouthguard Market Forecast to 2028 - COVID-19 Impact and Global Analysis By Product (Stock Mouthguard, Boil and Bite Mouthguard, Custom Made Mouthguard, Smart Mouthguards); Distribution Channel (Offline, Online), and Geography"" report has been added to ResearchAndMarkets.com's offering.



The sports mouthguard market is expected to reach US$ 4,958.90 million by 2028 from US$ 2,419.89 million in 2021; it is estimated to grow at a CAGR of 10.",https://finance.yahoo.com/news/global-sports-mouthguard-market-2021-101300067.html,21-10-2021 10:13,news
43,Worldwide Sports Mouthguard Industry to 2028,"October 21, 2021 09:18 AM Eastern Daylight Time DUBLIN--(BUSINESS WIRE)--The ""Global Sports Mouthguard Market Forecast to 2028 - COVID-19 Impact and Global Analysis By Product (Stock Mouthguard, Boil and Bite Mouthguard, Custom Made Mouthguard, Smart Mouthguards); Distribution Channel (Offline, Online), and Geography"" report has been added to ResearchAndMarkets.com's offering.



The sports mouthguard market is expected to reach US$ 4,958.90 million by 2028 from US$ 2,419.89 million in 2021; it is estimated to grow at a CAGR of 10.",https://www.businesswire.com/news/home/20211021005656/en/Worldwide-Sports-Mouthguard-Industry-to-2028---Rising-Number-of-Sports-Clubs-and-Leagues-Across-Globe-Presents-Opportunities---ResearchAndMarkets.com,21-10-2021 13:18,business
44,Youth Enrichment Brands Launches With Acquisition of i9 Sports®,"SAN RAFAEL, Calif.--(BUSINESS WIRE)--Oct 19, 2021--Youth Enrichment Brands, a new platform of leading youth activities brands, launched today following the acquisition of i9 Sports.Youth Enrichment Brands is the nation's leading youth activities company, offering camps, leagues, clinics, and other programs that annually serve more than 600,000 kids ranging from 2 to 18 years old. Backed by Atlanta-based Roark Capital, Youth Enrichment Brands encompasses US Sports Camps, the official provider of Nike Sports Camps, i9 Sports, the nation's largest youth sports league franchisor, and U.",https://www.businesswire.com/news/home/20211019005388/en/,19-10-2021 13:02,news
45,Another fantasy sports betting firm gets Louisiana license,"BATON ROUGE, La. (AP) — A second company is receiving a state license to run fantasy sports betting operations in the nearly three-quarters of Louisiana parishes where voters authorized the activity.The Louisiana Gaming Control Board voted unanimously Thursday for FanDuel to join DraftKings in launching fantasy sports contests in the 47 parishes allowed to have the gaming after the November 2018 election outcome. In fantasy sports, people create imaginary teams of real-life sports players and score points based on how those players perform in actual games.",https://www.chron.com/news/article/Another-fantasy-sports-betting-firm-gets-16552349.php,21-10-2021 19:21,news
46,Chelsea vs Liverpool on Sky Sports as festive TV dates announced,Tuesday November 3019:30 Newcastle v Norwich (Amazon Prime) 20:15 Leeds v Crystal Palace (Amazon Prime)Wednesday December 1 19:30 Southampton v Leicester (Amazon Prime)19:30 Watford v Chelsea (Amazon Prime)19:30 West Ham v Brighton (Amazon Prime)19:30 Wolves v Burnley (Amazon Prime)20:15 Aston Villa v Man City (Amazon Prime)20:15 Everton v Liverpool (Amazon Prime)Thursday December 2 19:30 Spurs v Brentford (Amazon Prime) 20:15 Man Utd v Arsenal (Amazon Prime)Saturday December 412:30 West Ham v C,https://www.dailymail.co.uk/sport/football/article-10104167/Chelsea-vs-Liverpool-January-2-shown-Sky-Sports-festive-TV-schedule-revealed.html,18-10-2021 15:15,sport
47,Every first-year FBS head coach's record at mid-season,"Bryan Harsin's culture has started to take root at Auburn.
The talk of 'getting better every week' and 'being 1-0' wasn't beginning to become stale and following the Georgia State game, there were some fans that were disgruntled with the product Auburn was putting out on the field. Just a few weeks later, Harsin still has his team in contention for the SEC West title and a potential trip to Atlanta for the SEC Championship still on the table.
Auburn currently sits at 5-2 and No. 19 in the week seven AP top 25 poll.",https://auburnwire.usatoday.com/lists/every-first-year-fbs-head-coachs-record-at-mid-season/,17-10-2021 18:00,news
48,Another fantasy sports betting firm gets Louisiana license,"BATON ROUGE, La. (AP) — A second company is receiving a state license to run fantasy sports betting operations in the nearly three-quarters of Louisiana parishes where voters authorized the activity.The Louisiana Gaming Control Board voted unanimously Thursday for FanDuel to join DraftKings in launching fantasy sports contests in the 47 parishes allowed to have the gaming after the November 2018 election outcome. In fantasy sports, people create imaginary teams of real-life sports players and score points based on how those players perform in actual games.",https://www.sfgate.com/news/article/Another-fantasy-sports-betting-firm-gets-16552349.php,21-10-2021 19:21,news
49,Chicago Bulls all-time roster: See which legends made the cut,"As part of celebrating their 75th anniversary, the NBA is releasing a list of the greatest 75 players of all-time, which they're calling NBA 75.

In honor of NBA 75, we have put together a similar list — the Chicago Bulls all-time roster. The roster is made up of the most important 15 players and three coaches in Bulls history, starting from 1966 to present day.

Now, for players like Dwyane Wade, who are undeniable Hall of Famers, don't fit the bill of making the all-time roster for the Bulls with playing such small stints with the franchise.",https://sports.yahoo.com/chicago-bulls-time-roster-see-225925691.html,18-10-2021 22:59,sport
50,Evaluating the Intertwined Relationships of the Drivers for University Technology Transfer,"This is an early access version, the complete PDF, HTML, and XML versions will be available soon.


Open AccessArticle by
 


Department of International Business, Tamkang University, New Taipei City 251301, Taiwan



Academic Editors: Tobias Meisen and Ricardo Colomo-Palacios

Appl. Sci. 2021, 11(20), 9668; https://doi.org/10.3390/app11209668 (registering DOI)


Received: 10 September 2021 / Revised: 8 October 2021 / Accepted: 14 October 2021 / Published: 16 October 2021



Download PDF

Citation Export

 BibTeX

EndNote

RIS

Cite This Paper


 

Universities are the best places to gather knowledge and innovation, but the basis of technological development lies in talented R&D personnel who provide services to enterprise R&D activities, research institutions, and universities.",https://www.mdpi.com/2076-3417/11/20/9668,16-10-2021 00:00,science
51,"Autonomous Navigation Technology Market Size, Revenue, Demand, Major Regions, Acquisitions Landscape, Current Trends, and Forecast 2026","The MarketWatch News Department was not involved in the creation of this content. Oct 20, 2021 (The Expresswire) --
""Final Report will add the analysis of the impact of COVID-19 on this industry.""Global'Autonomous Navigation Technology Market'presents in-depth analysis of the drivers and restraints impacting the overall market. Analysts have studied the key trends defining the trajectory of the market. The research report also includes an assessment of the achievements made by the players in the global Autonomous Navigation Technology market so far.",https://www.marketwatch.com/press-release/autonomous-navigation-technology-market-size-revenue-demand-major-regions-acquisitions-landscape-current-trends-and-forecast-2026-2021-10-20,20-10-2021 06:30,news
52,There is no YouTube Filter; It's AudibleMagic – TechCrunch,"After months of intense and very public debate, closely tied to the Google acquisition, YouTube is reported to have licensed copyright filtering technology from AudibleMagic. The San Jose Mercury News cites two unnamed sources as saying that Google will soon unveil filtering technology for YouTube from the leading third party filtering provider, Audible Magic.
What does this mean? It means that the months of assurances that YouTube had copyright filtering technology in development and about to be implemented were either a ruse to buy time or a failed effort that has collapsed under pressure today.",https://techcrunch.com/2007/02/22/there-is-no-youtube-filter-its-audiblemagic/,16-10-2021 15:43,news
53,How Technology Changed Communication — Pros and Cons,"Photo from UnsplashOriginally Posted On: https://www.rosiinc.com/blog/how-technology-changed-communication-pros-and-cons/I remember when I was issued company email in the mid 90s. It went a little something like ths: someone would call me on the phone to inform me that they sent me an email, and then I'd wait in my office cubicle staring a hole into my computer screen until it showed up. Sometimes information would arrive by fax; most of the time followed up with a phone call to explain in more detail the purpose of the communication.",https://medium.com/@TechBreaker/how-technology-changed-communication-pros-and-cons-6401cb82999e,17-10-2021 03:26,entertainment
54,The pitch deck for Trump's new media venture teases a 'conservative media universe' meant to rival the mainstream,"Trump launched his new Twitter copycat TRUTH after being booted from mainstream social platforms for violating their policies. Trump Media & Technology Group Corp.

Trump is rolling out a Twitter-like social app called TRUTH.

The app is part of a larger company that aims to create a media ecosystem free of ""liberal bias.""

The firm, TMTG, wants to become a ""media powerhouse"" to take on the streaming and news companies.

Former President Donald Trump is forging yet another attack on what he and other conservatives say is mainstream media's crusade to censor them.",https://news.yahoo.com/pitch-deck-trumps-media-venture-194214347.html,21-10-2021 19:42,news
55,Global Broadcast and Media Technology Market Size to 2027,"Pune, Oct. 20, 2021 (GLOBE NEWSWIRE) -- ""Final Report will add the analysis of the impact of COVID-19 on this industry.""

The global 'Broadcast and Media Technology Market' 2021-2027 study provides critical information related to the global, regional and top players including Broadcast and Media Technology market share analysis, winning strategies, recent developments, and financial planning. Besides providing information regarding the key players in the Broadcast and Media Technology market, the study also recalibrates, the impact of macroeconomic and microeconomic factors that has the potential to impact the growth of the Broadcast and Media Technology market.",https://www.globenewswire.com/news-release/2021/10/20/2317374/0/en/Global-Broadcast-and-Media-Technology-Market-Size-to-2027-Analysis-By-Upcoming-Trends-and-Challenges-Industry-Revenue-Growth-Factors-Future-Strategic-Planning-Key-Vendors-Market-Co.html,20-10-2021 12:05,news
56,Rackspace Technology Appoints Shashank Samant to Board of Directors,"SAN ANTONIO, Oct. 19, 2021 (GLOBE NEWSWIRE) -- Rackspace Technology® (NASDAQ: RXT), a leading end-to-end multicloud technology solutions company, today announced the appointment of Shashank Samant to its board of directors, effective as of October 18, 2021. ""Shashank has extensive global technology services industry experience and brings a passion for technology and innovation to Rackspace Technology,' said Kevin Jones, Director and CEO, Rackspace Technology. 'We are truly fortunate to have him join the board, and I am looking forward to working with him.",https://www.globenewswire.com/news-release/2021/10/19/2316890/0/en/Rackspace-Technology-Appoints-Shashank-Samant-to-Board-of-Directors.html,19-10-2021 20:45,news
57,Reynolds' Jit Papneja accepted into Forbes Technology Council,"I am elated to join this group of esteemed technology leaders. Reynolds' mission is to create A Better Tomorrow™ and technology plays a critical role in that WINSTON-SALEM, N.C. (PRWEB) October 17, 2021 Jit Papneja, Vice President, Data Analytics for the Reynolds American group of companies ('Reynolds'), has been accepted into Forbes Technology Council, an invitation-only community for world-class CIOs, CTOs, and technology executives Jit was vetted and selected by a review committee based on the depth and diversity of data analytics experience.",https://www.prweb.com/releases/reynolds_jit_papneja_accepted_into_forbes_technology_council/prweb18269052.htm,17-10-2021 00:00,tech
58,BeLive Technology appoints FTAG Ventures as Venture Builder to accelerate expansion,"BeLive Technology appoints FTAG Ventures as Venture Builder to accelerate expansion in the hypergrowth live streaming industry

SINGAPORE, Oct. 19, 2021 /PRNewswire/ -- Live streaming solutions provider BeLive Technology has announced it has appointed FTAG Ventures as Venture Builder to help accelerate the company's expansion in the live streaming industry, as it looks to enter the US market in early 2022.

BeLive Technology is the leading provider of live streaming solutions in Southeast Asia and has powered solutions to brands such as Zalora, Valiram Group, Rakuten Group, and Bukalapak.",https://finance.yahoo.com/news/belive-technology-appoints-ftag-ventures-125300785.html,19-10-2021 12:53,gaming
59,International Game Technology PLC (NYSE:IGT) Is About To Turn The Corner,"International Game Technology PLC (NYSE:IGT) is possibly approaching a major achievement in its business, so we would like to shine some light on the company. International Game Technology PLC operates and provides gaming technology products and services worldwide. The US$6.0b market-cap company posted a loss in its most recent financial year of US$939m and a latest trailing-twelve-month loss of US$428m shrinking the gap between loss and breakeven. As path to profitability is the topic on International Game Technology's investors mind, we've decided to gauge market sentiment.",https://www.nasdaq.com/articles/international-game-technology-plc-nyse%3Aigt-is-about-to-turn-the-corner-2021-10-16,16-10-2021 10:45,news
60,US Sports Technology Market Research Report (2021 to 2026),"October 22, 2021 09:50 AM Eastern Daylight Time DUBLIN--(BUSINESS WIRE)--The ""Sports Technology Market Research Report by Technology (Device, eSports, and Smart Stadium), by Sports Types (American Football/Rugby, Baseball, and Basketball), by State - United States Forecast to 2026 - Cumulative Impact of COVID-19"" report has been added to ResearchAndMarkets.com's offering.



The United States Sports Technology Market size was estimated at USD 2,259.44 million in 2020 and expected to reach USD 2,796.",https://www.businesswire.com/news/home/20211022005306/en/US-Sports-Technology-Market-Research-Report-2021-to-2026---by-Technology-Sports-Types-and-State---ResearchAndMarkets.com,22-10-2021 13:50,tech
61,US Sports Technology Market Research Report (2021 to 2026),"DUBLIN, October 22, 2021--(BUSINESS WIRE)--The ""Sports Technology Market Research Report by Technology (Device, eSports, and Smart Stadium), by Sports Types (American Football/Rugby, Baseball, and Basketball), by State - United States Forecast to 2026 - Cumulative Impact of COVID-19"" report has been added to ResearchAndMarkets.com's offering.

The United States Sports Technology Market size was estimated at USD 2,259.44 million in 2020 and expected to reach USD 2,796.81 million in 2021, at a CAGR 20.",https://finance.yahoo.com/news/us-sports-technology-market-research-135000436.html,22-10-2021 13:50,news
62,"WM Technology, Inc. Announces Third Quarter 2021 Financial Results Conference Call","October 21, 2021 04:15 PM Eastern Daylight Time IRVINE, Calif.--(BUSINESS WIRE)--WM Technology, Inc. ('WM Technology' or the 'Company') (Nasdaq: MAPS), a leading technology and software infrastructure provider to the cannabis industry, today announced it will report financial results for its third quarter ended September 30, 2021 after market close on Thursday, November 11, 2021. Management will host a conference call and webcast to discuss the Company's financial results at 2:00 p.m. Pacific Time (or 5:00 p.",https://www.businesswire.com/news/home/20211021005996/en/WM-Technology-Inc.-Announces-Third-Quarter-2021-Financial-Results-Conference-Call,21-10-2021 20:15,news
63,Singapore Defence Technology Summit 2021 Taps ARHT Media's HoloPresence Technology,"Heidi Shyu, Under Secretary of Defense for Research and Engineering, United States Department of Defense (DoD) appears as a live hologram thanks to ARHT Media's HoloPresence technology

Heidi Shyu, Under Secretary of Defense for Research and Engineering, United States Department of Defense (DoD) appears as a live hologram thanks to ARHT Media's HoloPresence technology. Heidi Shyu was appearing for her keynote at the Singapore Defence Technology Summit 2021 and was beamed from Washington DC.

Heidi Shyu, Under Secretary of Defense for Research and Engineering, United States Department of Defense (DoD) appears as a live hologram thanks to ARHT Media's HoloPresence technology.",https://finance.yahoo.com/news/singapore-defence-technology-summit-2021-123000954.html,18-10-2021 12:30,news
64,AUKUS essentially a ‘defence industry and technology information sharing arrangement',"Former defence department secretary Dennis Richardson says AUKUS is essentially a 'defence industry and technology information sharing arrangement'. Speaking with Sky News Australia, Mr Richardson said AUKUS is 'particularly important' because it brings together Australia, the US and the UK. 'It is not an alliance as a lot of commentators refer to it.'It is not a pact. 'It is essentially a defence industry and technology information sharing arrangement.'",https://www.news.com.au/national/aukus-essentially-a-defence-industry-and-technology-information-sharing-arrangement/video/5d5aff920963d14e0d42936aa3f4a3c1,17-10-2021 08:17,news
